topseller_api,everglades/products + crocotile/tile/data,3,218,273,273,33,273,organic,api_enriched,True,False,True,,2000246937,2000246937,2000246938,2000246938,273,33,,https://www.otto.de/p/lenovo-l24-4e-a25238fl0-led-monitor-61-cm-24-1920-x-1080-px-full-hd-4-6-ms-reaktionszeit-100-hz-ips-2000246937/?variationId=2000246938,"Lenovo L24-4e(A25238FL0) LED-Monitor (61 cm/24 "", 1920 x 1080 px, Full HD, 4, 6 ms Reaktionszeit, 100 Hz, IPS)","Lenovo L24-4e(A25238FL0) LED-Monitor (61 cm/24 "", 1920 x 1080 px, Full HD, 4, 6 ms Reaktionszeit, 100 Hz, IPS)",245,,"L24-4e(A25238FL0) LED-Monitor (61 cm/24 "", 1920 x 1080 px, Full HD, 4, 6 ms Reaktionszeit, 100 Hz, IPS)",L24-4e(A25238FL0) LED-Monitor,https://www.otto.de/p/lenovo-l24-4e-a25238fl0-led-monitor-61-cm-24-1920-x-1080-px-full-hd-4-6-ms-reaktionszeit-100-hz-ips-2000246937/,"69,99 €","99,00 €",-29%,"69,99 €","99,00 €",-29%,True,False,,,nur bis Dienstag,nur bis Dienstag,lieferbar - am nächsten Werktag bei dir,Available - at your door the next working day,AVAILABLE,4,4.5,E,https://i.otto.de/i/otto/a6d390f0-f3d9-5484-89d2-cb16928bbc11?$dv_energieetikett$,https://d.otto.de/files/1669be74-8483-5999-938c-c67ffc328a8c.pdf,https://i.otto.de/i/otto/1bb076d3-847c-5ce1-9fc1-d494a7f6f048?$responsive_ft2$,Lenovo,Monitore,61 cm/ 24 Zoll,,"1920 x 1080 px, Full HD",100 Hz,True,,,exclude_keyword:monitor,False
topseller_api,everglades/products + crocotile/tile/data,3,218,275,275,35,275,organic,api_enriched,True,False,True,S0RDB0KO,S0RDB0KO,S0RDB0KO,S0RDB0KOQ5YJ,S0RDB0KOQ5YJ,275,35,,https://www.otto.de/p/digiquest-wecam-smartcam-modul-hd-ciplus-wifi-modul-fuer-tivusat-ciplus-modul-S0RDB0KO/?variationId=S0RDB0KOQ5YJ,DIGIQuest WeCAM SmartCam Modul - HD CI+ WiFi Modul für TivuSat CI+-Modul,DIGIQuest WeCAM SmartCam Modul - HD CI+ WiFi Modul für TivuSat CI+-Modul,247,,WeCAM SmartCam Modul - HD CI+ WiFi Modul für TivuSat CI+-Modul,WeCAM SmartCam Modul - HD CI+ WiFi Modul für TivuSat CI+-Modul,https://www.otto.de/p/digiquest-wecam-smartcam-modul-hd-ciplus-wifi-modul-fuer-tivusat-ciplus-modul-S0RDB0KO/,"43,90 €","49,90 €",-12%,"43,90 €","49,90 €",-12%,True,False,,,,,lieferbar - in 2-3 Werktagen bei dir,Available - at your door in 2-3 working days,AVAILABLE,1,4.0,,,,https://i.otto.de/i/otto/f84c1fab-c561-579a-bade-0355f2c9a0d1?$responsive_ft2$,DIGIQuest,CI-Module,,,,,False,,,exclude_keyword:ci+-modul,False
topseller_api,everglades/products + crocotile/tile/data,3,218,278,278,38,278,organic,api_enriched,True,False,True,,1874959742,1874959742,1874959743,1874959743,278,38,,https://www.otto.de/p/msi-mag-32c6x-curved-gaming-monitor-80-cm-32-1920-x-1080-px-full-hd-1-ms-reaktionszeit-250-hz-va-led-3-jahre-herstellergarantie-1874959742/?variationId=1874959743,"MSI MAG 32C6X Curved-Gaming-Monitor (80 cm/32 "", 1920 x 1080 px, Full HD, 1 ms Reaktionszeit, 250 Hz, VA LED, 3 Jahre Herstellergarantie)","MSI MAG 32C6X Curved-Gaming-Monitor (80 cm/32 "", 1920 x 1080 px, Full HD, 1 ms Reaktionszeit, 250 Hz, VA LED, 3 Jahre Herstellergarantie)",250,,"MAG 32C6X Curved-Gaming-Monitor (80 cm/32 "", 1920 x 1080 px, Full HD, 1 ms Reaktionszeit, 250 Hz, VA LED, 3 Jahre Herstellergarantie)",MAG 32C6X Curved-Gaming-Monitor,https://www.otto.de/p/msi-mag-32c6x-curved-gaming-monitor-80-cm-32-1920-x-1080-px-full-hd-1-ms-reaktionszeit-250-hz-va-led-3-jahre-herstellergarantie-1874959742/,"169,90 €","299,00 €",-43%,"169,90 €","299,00 €",-43%,True,False,Sehr beliebt,Very popular,nur für kurze Zeit,Only for a short time,lieferbar - am nächsten Werktag bei dir,Available - at your door the next working day,AVAILABLE,83,4.5,E,https://i.otto.de/i/otto/1f3f669c-f65f-5c1a-9acf-ba9b4786f6f8?$dv_energieetikett$,https://d.otto.de/files/9da5fb40-1e53-5b7d-9722-d8ce61f68d0c.pdf,https://i.otto.de/i/otto/ac64d264-bde4-5372-b51d-eb7f63c8ecf7?$responsive_ft2$,MSI,Monitore,80 cm/ 32 Zoll,,"1920 x 1080 px, Full HD",250 Hz,True,,,exclude_keyword:monitor,False
topseller_api,everglades/products + crocotile/tile/data,3,218,279,279,39,279,organic,api_enriched,True,False,True,75402129,C1900586554,1900586554,1900586556,1900586556,279,39,,https://www.otto.de/p/one-for-all-ersatzfernbedienung-urc-1915-fuer-grundig-tv-fernbedienung-1-in-1-C1900586554/?variationId=1900586556,One for All Ersatzfernbedienung URC 1915 für Grundig TV Fernbedienung (1-in-1),One for All Ersatzfernbedienung URC 1915 für Grundig TV Fernbedienung (1-in-1),251,,Ersatzfernbedienung URC 1915 für Grundig TV Fernbedienung (1-in-1),Ersatzfernbedienung URC 1915 für Grundig TV Fernbedienung,https://www.otto.de/p/one-for-all-ersatzfernbedienung-urc-1915-fuer-grundig-tv-fernbedienung-1-in-1-C1900586554/,"17,86 €","21,99 €",-19%,"17,86 €","21,99 €",-19%,True,True,,,,,lieferbar - in 2-3 Werktagen bei dir,Available - at your door in 2-3 working days,AVAILABLE,16,4.5,,,,https://i.otto.de/i/otto/1331fbc6-2baa-558d-b686-b06c8b55a0a7?$responsive_ft2$,One For All,Fernbedienungen,,,,,True,,,exclude_accessory_keyword:fernbedienung,False
topseller_api,everglades/products + crocotile/tile/data,3,218,282,282,42,282,organic,api_enriched,True,False,True,S0BDF02T,CS02GN068,CS02GN068,S0BDF02TN2C3,S0BDF02TN2C3,282,42,,https://www.otto.de/p/hdplus-streaming-stick-ip-tv-stick-android-tv-inkl-3-monate-hdplus-ip-4k-uhd-CS02GN068/?variationId=S0BDF02TN2C3,"HD+ Streaming-Stick IP TV-Stick, Android TV, Inkl. 3 Monate HD+ IP, 4k UHD","HD Plus HD+ IP TV-Stick HD+-Modul, HD+ IP TV-Stick inkl. HD+ IP für 3 Monate",253,,"Streaming-Stick IP TV-Stick, Android TV, Inkl. 3 Monate IP, 4k UHD","Streaming-Stick IP TV-Stick, Android TV",https://www.otto.de/p/hdplus-streaming-stick-ip-tv-stick-android-tv-inkl-3-monate-hdplus-ip-4k-uhd-CS02GN068/,"64,99 €",,,"64,99 €",,,False,True,,,,,lieferbar - in 2-3 Werktagen bei dir,Available - at your door in 2-3 working days,AVAILABLE,16,4.0,,,,https://i.otto.de/i/otto/00b610b2-41cf-54d9-9841-0f4f6001f92c?$responsive_ft2$,HD+,CI-Module,,,,,False,,,exclude_keyword:streaming-stick,False
topseller_api,everglades/products + crocotile/tile/data,3,218,286,286,46,286,organic,api_enriched,True,False,True,,690691571,690691571,690691572,690691572,286,46,,https://www.otto.de/p/home-affaire-lowboard-lowboard-d-wahlweise-mit-oder-ohne-beleuchtung-modernes-tv-board-ohne-griffe-mit-viel-stauraum-stehend-und-haengend-690691571/?variationId=690691572,"Home affaire Lowboard LOWBOARD D, wahlweise mit oder ohne Beleuchtung, modernes TV-Board ohne Griffe, mit viel Stauraum,stehend und hängend","Home affaire Lowboard LOWBOARD D, wahlweise mit oder ohne Beleuchtung, modernes TV-Board ohne Griffe, mit viel Stauraum,stehend und hängend",257,,"Lowboard LOWBOARD D, wahlweise mit oder ohne Beleuchtung, modernes TV-Board ohne Griffe, mit viel Stauraum,stehend und hängend","Lowboard LOWBOARD D, wahlweise mit oder ohne Beleuchtung",https://www.otto.de/p/home-affaire-lowboard-lowboard-d-wahlweise-mit-oder-ohne-beleuchtung-modernes-tv-board-ohne-griffe-mit-viel-stauraum-stehend-und-haengend-690691571/,"99,99 €","199,00 €",-50%,"99,99 €","199,00 €",-50%,True,True,Sehr beliebt,Very popular,nur für kurze Zeit,Only for a short time,lieferbar - in  6-8 Werktagen bei dir,lieferbar - in  6-8 Werktagen bei dir,AVAILABLE,744,4.5,,,,https://i.otto.de/i/otto/0e39ab58-985b-5894-98be-941bcf9451a3?$responsive_ft2$,Home affaire,Sideboards,,,,,True,,,"exclude_keyword:lowboard,tv-board,beleuchtung",False
topseller_api,everglades/products + crocotile/tile/data,3,218,295,295,55,295,organic,api_enriched,True,False,True,S0NBV0OJ,S0NBV0OJ,S0NBV0OJ,S0NBV0OJA1OK,S0NBV0OJA1OK,295,55,,https://www.otto.de/p/alltro-ersatz-tv-fernbedienung-fuer-telefunken-smart-tv-dvd-rc5118-fernseher-fernbedienung-mit-youtube-netflix-tasten-S0NBV0OJ/?variationId=S0NBV0OJA1OK,"Alltro Ersatz TV Fernbedienung für Telefunken Smart TV DVD RC5118 Fernseher Fernbedienung (Mit YouTube-, Netflix-Tasten)","Alltro Ersatz TV Fernbedienung für Telefunken Smart TV DVD RC5118 Fernseher Fernbedienung (Mit YouTube-, Netflix-Tasten)",265,,"Ersatz TV Fernbedienung für Telefunken Smart TV DVD RC5118 Fernseher Fernbedienung (Mit YouTube-, Netflix-Tasten)",Ersatz TV Fernbedienung für Telefunken Smart TV DVD RC5118 Fernseher Fernbedienung,https://www.otto.de/p/alltro-ersatz-tv-fernbedienung-fuer-telefunken-smart-tv-dvd-rc5118-fernseher-fernbedienung-mit-youtube-netflix-tasten-S0NBV0OJ/,"11,95 €","14,95 €",-20%,"11,95 €","14,95 €",-20%,True,False,,,,,lieferbar - in 2-3 Werktagen bei dir,Available - at your door in 2-3 working days,AVAILABLE,2,5.0,,,,https://i.otto.de/i/otto/5712ae4c-eb87-4193-a869-f724d258869f?$responsive_ft2$,Alltro,Fernbedienungen,,,,,False,,,exclude_accessory_keyword:fernbedienung,False
topseller_api,everglades/products + crocotile/tile/data,3,218,299,299,59,299,organic,api_enriched,True,False,True,S0JC50IY,S0JC50IY,S0JC50IY,S0JC50IYEX8Z,S0JC50IYEX8Z,299,59,,https://www.otto.de/p/alltro-ersatz-tv-fernbedienung-fuer-ok-tv-ole-328w-d4-ole-398b-d4-ole-398b-d4s-S0JC50IY/?variationId=S0JC50IYEX8Z,Alltro Ersatz TV Fernbedienung (für OK TV / OLE 328W D4 / OLE 398B-D4 / OLE 398B-D4S),Alltro Ersatz TV Fernbedienung (für OK TV / OLE 328W D4 / OLE 398B-D4 / OLE 398B-D4S),268,,Ersatz TV Fernbedienung (für OK TV / OLE 328W D4 / OLE 398B-D4 / OLE 398B-D4S),Ersatz TV Fernbedienung,https://www.otto.de/p/alltro-ersatz-tv-fernbedienung-fuer-ok-tv-ole-328w-d4-ole-398b-d4-ole-398b-d4s-S0JC50IY/,"12,95 €","14,95 €",-13%,"12,95 €","14,95 €",-13%,True,False,,,,,lieferbar - in 2-3 Werktagen bei dir,Available - at your door in 2-3 working days,AVAILABLE,,,,,,https://i.otto.de/i/otto/2abb13e8-29ee-4025-b833-33602f81f2ba?$responsive_ft2$,Alltro,Fernbedienungen,,,,,False,,,exclude_accessory_keyword:fernbedienung,False
topseller_api,everglades/products + crocotile/tile/data,3,218,302,302,62,302,organic,api_enriched,True,False,True,,S0B7N07A,S0B7N07A,S0B7N07AJ5RI,S0B7N07AJ5RI,302,62,,https://www.otto.de/p/sonni-tv-schrank-schwarzer-wandhalter-minimalistischer-tv-staender-mit-led-beleuchtung-S0B7N07A/?variationId=S0B7N07AJ5RI,SONNI TV-Schrank Schwarzer Wandhalter Minimalistischer TV-Ständer mit LED-Beleuchtung,SONNI TV-Schrank Schwarzer Wandhalter Minimalistischer TV-Ständer mit LED-Beleuchtung,271,,TV-Schrank Schwarzer Wandhalter Minimalistischer TV-Ständer mit LED-Beleuchtung,TV-Schrank Schwarzer Wandhalter Minimalistischer TV-Ständer mit LED-Beleuchtung,https://www.otto.de/p/sonni-tv-schrank-schwarzer-wandhalter-minimalistischer-tv-staender-mit-led-beleuchtung-S0B7N07A/,"99,99 €","235,99 €",-58%,"99,99 €","235,99 €",-58%,True,False,,,,,lieferbar - in 5-6 Werktagen bei dir,Available - at your door in 5-6 working days,AVAILABLE,9,3.5,,,,https://i.otto.de/i/otto/2795b8f3-0ff0-4b6d-8db9-f6195e0911d3?$responsive_ft2$,SONNI,Schränke,,,,,False,,,"exclude_keyword:wandhalter,tv-schrank,schrank,tv-ständer,ständer,beleuchtung",False
topseller_api,everglades/products + crocotile/tile/data,3,218,305,305,65,305,organic,api_enriched,True,False,True,,S0VF00DS,S0VF00DS,S0VF00DSV4SM,S0VF00DSV4SM,305,65,,https://www.otto.de/p/rfiver-tv-staender-rollbar-tv-wagen-auf-rollen-fuer-26-65-zoll-fernseher-fernsehstaender-bis-65-zoll-1-tlg-drehbarer-tv-staender-tv-standfuss-hoehenverstellbar-neigbar-max-35-kg-vesa-400x400-mm-S0VF00DS/?variationId=S0VF00DSV4SM,"Rfiver TV-Ständer Rollbar TV Wagen auf Rollen für 26-65 Zoll Fernseher, Fernsehständer, (bis 65 Zoll, 1-tlg., drehbarer TV-Ständer​, TV Standfuß, höhenverstellbar Neigbar Max. 35 KG VESA 400x400 mm)","Rfiver TV-Ständer Rollbar TV Wagen auf Rollen für 26-65 Zoll Fernseher, Fernsehständer, (bis 65 Zoll, 1-tlg., drehbarer TV-Ständer​, TV Standfuß, höhenverstellbar Neigbar Max. 35 KG VESA 400x400 mm)",273,,"TV-Ständer Rollbar TV Wagen auf Rollen für 26-65 Zoll Fernseher, Fernsehständer, (bis 65 Zoll, 1-tlg., drehbarer TV-Ständer​, TV Standfuß, höhenverstellbar Neigbar Max. 35 KG VESA 400x400 mm)","TV-Ständer Rollbar TV Wagen auf Rollen für 26-65 Zoll Fernseher, Fernsehständer",https://www.otto.de/p/rfiver-tv-staender-rollbar-tv-wagen-auf-rollen-fuer-26-65-zoll-fernseher-fernsehstaender-bis-65-zoll-1-tlg-drehbarer-tv-staender-tv-standfuss-hoehenverstellbar-neigbar-max-35-kg-vesa-400x400-mm-S0VF00DS/,"64,99 €","99,99 €",-35%,"64,99 €","99,99 €",-35%,True,False,,,,,lieferbar - in 3-4 Werktagen bei dir,Available - at your door in 3-4 working days,AVAILABLE,8,4.0,,,,https://i.otto.de/i/otto/745a4341-3b6e-4029-8c71-fdacb996cb2e?$responsive_ft2$,Rfiver,Gerätehalterungen,,,,,False,,,"exclude_keyword:tv-ständer,ständer",False
topseller_api,everglades/products + crocotile/tile/data,3,218,314,314,74,314,organic,api_enriched,True,False,True,S0WBW0XY,S0WBW0XY,S0WBW0XY,S0WBW0XY2NJY,S0WBW0XY2NJY,314,74,,https://www.otto.de/p/alltro-ersatz-tv-fernbedienung-fuer-dual-rc4875-rc-4875-fernseher-fernbedienung-S0WBW0XY/?variationId=S0WBW0XY2NJY,Alltro Ersatz TV Fernbedienung für Dual RC4875 / RC-4875 / Fernseher Fernbedienung,Alltro Ersatz TV Fernbedienung für Dual RC4875 / RC-4875 / Fernseher Fernbedienung,281,,Ersatz TV Fernbedienung für Dual RC4875 / RC-4875 / Fernseher Fernbedienung,Ersatz TV Fernbedienung für Dual RC4875 / RC-4875 / Fernseher Fernbedienung,https://www.otto.de/p/alltro-ersatz-tv-fernbedienung-fuer-dual-rc4875-rc-4875-fernseher-fernbedienung-S0WBW0XY/,"11,95 €","14,95 €",-20%,"11,95 €","14,95 €",-20%,True,False,,,,,lieferbar - in 2-3 Werktagen bei dir,Available - at your door in 2-3 working days,AVAILABLE,2,4.5,,,,https://i.otto.de/i/otto/26ebf39a-f037-49a6-97f2-980e79885532?$responsive_ft2$,Alltro,Fernbedienungen,,,,,False,,,exclude_accessory_keyword:fernbedienung,False
topseller_api,everglades/products + crocotile/tile/data,3,218,317,317,77,317,organic,api_enriched,True,False,True,S0ECA049,S0ECA049,S0ECA049,S0ECA049TWQL,S0ECA049TWQL,317,77,,https://www.otto.de/p/alltro-ersatz-fernbedienung-fuer-panasonic-n2qayb000830-tv-fernseher-fernbedienung-S0ECA049/?variationId=S0ECA049TWQL,Alltro Ersatz Fernbedienung für Panasonic N2QAYB000830 TV Fernseher Fernbedienung,Alltro Ersatz Fernbedienung für Panasonic N2QAYB000830 TV Fernseher Fernbedienung,284,,Ersatz Fernbedienung für Panasonic N2QAYB000830 TV Fernseher Fernbedienung,Ersatz Fernbedienung für Panasonic N2QAYB000830 TV Fernseher Fernbedienung,https://www.otto.de/p/alltro-ersatz-fernbedienung-fuer-panasonic-n2qayb000830-tv-fernseher-fernbedienung-S0ECA049/,"11,95 €","14,95 €",-20%,"11,95 €","14,95 €",-20%,True,False,,,,,lieferbar - in 2-3 Werktagen bei dir,Available - at your door in 2-3 working days,AVAILABLE,5,5.0,,,,https://i.otto.de/i/otto/44fe7a62-fbbe-4a93-9abd-f5c2529008bc?$responsive_ft2$,Alltro,Fernbedienungen,,,,,False,,,exclude_accessory_keyword:fernbedienung,False
topseller_api,everglades/products + crocotile/tile/data,3,218,318,318,78,318,organic,api_enriched,True,False,True,,C2003538578,2003538578,2003538579,2003538579,318,78,,https://www.otto.de/p/philips-philips-monitor-24e2n1100lb-24-zoll-full-hd-bildschirm-tft-monitor-1920-x-1080-pixel-full-hd-px-1920-x-1080-pixel-full-hd-4-ms-reaktionszeit-full-hd-ergonomisches-neigedesign-C2003538578/?variationId=2003538579,"Philips 24E2N1100LB LCD-Monitor (60,5 cm/24 "", 1920 x 1080 px, Full HD, 1 ms Reaktionszeit, 100 Hz)","Philips 24E2N1100LB LCD-Monitor (60,5 cm/24 "", 1920 x 1080 px, Full HD, 1 ms Reaktionszeit, 100 Hz)",285,,"24E2N1100LB LCD-Monitor (60,5 cm/24 "", 1920 x 1080 px, Full HD, 1 ms Reaktionszeit, 100 Hz)",24E2N1100LB LCD-Monitor,https://www.otto.de/p/philips-philips-monitor-24e2n1100lb-24-zoll-full-hd-bildschirm-tft-monitor-1920-x-1080-pixel-full-hd-px-1920-x-1080-pixel-full-hd-4-ms-reaktionszeit-full-hd-ergonomisches-neigedesign-C2003538578/,"65,37 €","99,00 €",-34%,"65,37 €","99,00 €",-34%,True,True,,,,,lieferbar - in 2-3 Werktagen bei dir,Available - at your door in 2-3 working days,AVAILABLE,10,4.5,E,https://i.otto.de/i/otto/8f12b7d1-5775-5ef2-ba89-efc6e2e73ac3?$dv_energieetikett$,https://d.otto.de/files/60b9f31b-f653-51f6-b10e-1c0f33e83033.pdf,https://i.otto.de/i/otto/4439e0ab-5a2e-5d77-9124-7b40639ea9fc?$responsive_ft2$,Philips,Monitore,"60,5 cm/ 24 Zoll",,"1920 x 1080 px, Full HD",100 Hz,True,,,exclude_keyword:monitor,False
topseller_api,everglades/products + crocotile/tile/data,3,218,320,320,80,320,organic,api_enriched,True,False,True,S0C1Z0ZHA5I,S0C1Z0ZH,S0C1Z0ZH,S0C1Z0ZH25LB,S0C1Z0ZH25LB,320,80,,https://www.otto.de/p/primewire-sat-kabel-koax-f-verbinder-1250-cm-premium-hdtv-sat-koaxialkabel-4fach-schirmung-135db-75-ohm-12-5m-S0C1Z0ZH/?variationId=S0C1Z0ZH25LB,"Primewire SAT-Kabel, Koax, F-Verbinder (150 cm), Premium HDTV SAT Koaxialkabel, 4fach Schirmung, 135dB, 75 Ohm - 1,5m","Primewire SAT-Kabel, Koax, F-Verbinder (150 cm), Premium HDTV SAT Koaxialkabel, 4fach Schirmung, 135dB, 75 Ohm - 1,5m",287,,"SAT-Kabel, Koax, F-Verbinder (150 cm), Premium HDTV SAT Koaxialkabel, 4fach Schirmung, 135dB, 75 Ohm - 1,5m",SAT-Kabel,https://www.otto.de/p/primewire-sat-kabel-koax-f-verbinder-1250-cm-premium-hdtv-sat-koaxialkabel-4fach-schirmung-135db-75-ohm-12-5m-S0C1Z0ZH/,"8,95 €","13,99 €",-36%,"8,95 €","13,99 €",-36%,True,True,Sehr beliebt,Very popular,,,lieferbar - in 2-3 Werktagen bei dir,Available - at your door in 2-3 working days,AVAILABLE,218,4.5,,,,https://i.otto.de/i/otto/c896a47d-d2d4-50bf-a318-031a2ec5e254?$responsive_ft2$,Primewire,Kabel,,,,,False,,,exclude_keyword:kabel,False
topseller_api,everglades/products + crocotile/tile/data,3,218,322,322,82,322,organic,api_enriched,True,False,True,S0CH50C6,S0CH50C6,S0CH50C6,S04GB0YCK1XB,S04GB0YCK1XB,322,82,,https://www.otto.de/p/mycotech-fernbedienung-fuer-chiq-changhong-saba-smart-tv-fernseher-fernbedienung-S0CH50C6/?variationId=S04GB0YCK1XB,Mycotech Fernbedienung für Chiq Changhong Saba Smart-TV Fernseher Fernbedienung,Mycotech Fernbedienung für Chiq Changhong Saba Smart-TV Fernseher Fernbedienung,289,,Fernbedienung für Chiq Changhong Saba Smart-TV Fernseher Fernbedienung,Fernbedienung für Chiq Changhong Saba Smart-TV Fernseher Fernbedienung,https://www.otto.de/p/mycotech-fernbedienung-fuer-chiq-changhong-saba-smart-tv-fernseher-fernbedienung-S0CH50C6/,"8,74 €","19,99 €",-56%,"8,74 €","19,99 €",-56%,True,False,,,,,lieferbar - in 2-3 Werktagen bei dir,Available - at your door in 2-3 working days,AVAILABLE,3,5.0,,,,https://i.otto.de/i/otto/44f56c6d-72be-438c-8998-7ac9af923e4e?$responsive_ft2$,Mycotech,Fernbedienungen,,,,,False,,,exclude_accessory_keyword:fernbedienung,False
topseller_api,everglades/products + crocotile/tile/data,3,218,323,323,83,323,organic,api_enriched,True,False,True,,CS07GJ00Z,CS07GJ00Z,S0WDH0KVS9TQ,S0WDH0KVS9TQ,323,83,,https://www.otto.de/p/hama-tv-staender-tv-deckenhalterung-32-bis-65-deckenhalter-bis-65-zoll-tv-halterung-halter-fuer-decke-dachschraege-schrank-kueche-unterschrank-CS07GJ00Z/?variationId=S0WDH0KVS9TQ,"Hama TV-Ständer TV Deckenhalterung 32"" bis 65"" Deckenhalter, (bis 65 Zoll, TV Halterung Halter für Decke Dachschräge Schrank Küche Unterschrank)","Hama TV-Ständer TV Deckenhalterung 32"" bis 65"" Deckenhalter, (bis 65 Zoll, TV Halterung Halter für Decke Dachschräge Schrank Küche Unterschrank)",290,,"TV-Ständer TV Deckenhalterung 32"" bis 65"" Deckenhalter, (bis 65 Zoll, TV Halterung Halter für Decke Dachschräge Schrank Küche Unterschrank)","TV-Ständer TV Deckenhalterung 32"" bis 65"" Deckenhalter",https://www.otto.de/p/hama-tv-staender-tv-deckenhalterung-32-bis-65-deckenhalter-bis-65-zoll-tv-halterung-halter-fuer-decke-dachschraege-schrank-kueche-unterschrank-CS07GJ00Z/,"33,90 €","85,00 €",-60%,"33,90 €","85,00 €",-60%,True,False,,,,,lieferbar - in 2-3 Werktagen bei dir,Available - at your door in 2-3 working days,AVAILABLE,5,5.0,,,,https://i.otto.de/i/otto/fa30635c-4bed-502f-8684-347f7a168aeb?$responsive_ft2$,Hama,Gerätehalterungen,,,,,False,,,"exclude_keyword:halterung,schrank,tv-ständer,ständer",False
topseller_api,everglades/products + crocotile/tile/data,3,218,325,325,85,325,organic,api_enriched,True,False,True,,1716781374,1716781374,1716781375,1716781375,325,85,,https://www.otto.de/p/otto-home-wohnwand-paris-vitrine-tueranschlag-links-rechts-wechselbar-komplett-set-4-st-grifflose-design-stehend-und-haengend-montierbar-1716781374/?variationId=1716781375,"OTTO home Wohnwand PARIS, Vitrine Türanschlag links/rechts wechselbar, (Komplett-Set, 4-St), grifflose Design, stehend und hängend montierbar","OTTO home Wohnwand PARIS, Vitrine Türanschlag links/rechts wechselbar, (Komplett-Set, 4-St), grifflose Design, stehend und hängend montierbar",292,,"Wohnwand PARIS, Vitrine Türanschlag links/rechts wechselbar, (Komplett-Set, 4-St), grifflose Design, stehend und hängend montierbar","Wohnwand PARIS, Vitrine Türanschlag links/rechts wechselbar",https://www.otto.de/p/otto-home-wohnwand-paris-vitrine-tueranschlag-links-rechts-wechselbar-komplett-set-4-st-grifflose-design-stehend-und-haengend-montierbar-1716781374/,"259,99 €","699,00 €",-63%,"259,99 €","699,00 €",-63%,True,False,,,nur für kurze Zeit,Only for a short time,lieferbar - in  6-8 Werktagen bei dir,lieferbar - in  6-8 Werktagen bei dir,AVAILABLE,114,4.0,,,,https://i.otto.de/i/otto/d5a2296a-40cb-508f-bb1f-2e50c9e0126b?$responsive_ft2$,OTTO home,Kastenmöbel-Sets,,,,,True,,,missing_tv_positive_keyword,False
topseller_api,everglades/products + crocotile/tile/data,3,218,327,327,87,327,organic,api_enriched,True,False,True,S0QFW0ZX,S0QFW0ZX,S0QFW0ZX,S0QFW0ZXW4NE,S0QFW0ZXW4NE,327,87,,https://www.otto.de/p/alltro-universal-fernbedienung-fuer-telefunken-lcd-led-smart-tv-fernseher-fernbedienung-S0QFW0ZX/?variationId=S0QFW0ZXW4NE,Alltro Universal Fernbedienung für Telefunken LCD LED Smart TV Fernseher Fernbedienung,Alltro Universal Fernbedienung für Telefunken LCD LED Smart TV Fernseher Fernbedienung,294,,Universal Fernbedienung für Telefunken LCD LED Smart TV Fernseher Fernbedienung,Universal Fernbedienung für Telefunken LCD LED Smart TV Fernseher Fernbedienung,https://www.otto.de/p/alltro-universal-fernbedienung-fuer-telefunken-lcd-led-smart-tv-fernseher-fernbedienung-S0QFW0ZX/,"14,95 €",,,"14,95 €",,,False,False,,,,,lieferbar - in 2-3 Werktagen bei dir,Available - at your door in 2-3 working days,AVAILABLE,1,4.0,,,,https://i.otto.de/i/otto/1d661e79-c214-4395-9c54-7506fcb3ac6a?$responsive_ft2$,Alltro,Fernbedienungen,,,,,False,,,exclude_accessory_keyword:fernbedienung,False
topseller_api,everglades/products + crocotile/tile/data,3,218,334,334,94,334,organic,api_enriched,True,False,True,S0JC50HE,S0JC50HE,S0JC50HE,S0JC50HEIKOB,S0JC50HEIKOB,334,94,,https://www.otto.de/p/alltro-ersatz-tv-fernbedienung-fuer-blaupunkt-tv-40-148o-gb-11b-fegbqu-eu-S0JC50HE/?variationId=S0JC50HEIKOB,Alltro Ersatz TV Fernbedienung (für Blaupunkt TV 40/148O-GB-11B-FEGBQU-EU),Alltro Ersatz TV Fernbedienung (für Blaupunkt TV 40/148O-GB-11B-FEGBQU-EU),301,,Ersatz TV Fernbedienung (für Blaupunkt TV 40/148O-GB-11B-FEGBQU-EU),Ersatz TV Fernbedienung,https://www.otto.de/p/alltro-ersatz-tv-fernbedienung-fuer-blaupunkt-tv-40-148o-gb-11b-fegbqu-eu-S0JC50HE/,"12,95 €","14,95 €",-13%,"12,95 €","14,95 €",-13%,True,False,,,,,lieferbar - in 2-3 Werktagen bei dir,Available - at your door in 2-3 working days,AVAILABLE,1,5.0,,,,https://i.otto.de/i/otto/2abb13e8-29ee-4025-b833-33602f81f2ba?$responsive_ft2$,Alltro,Fernbedienungen,,,,,False,,,exclude_accessory_keyword:fernbedienung,False
topseller_api,everglades/products + crocotile/tile/data,3,218,335,335,95,335,organic,api_enriched,True,False,True,,S06F102O,S06F102O,S06F102ONAS7,S06F102ONAS7,335,95,,https://www.otto.de/p/wlive-tv-schrank-135-160-cm-lowboard-mit-rgb-led-fuer-fernseher-bis-60-65-70-zoll-20-farben-rgb-fernsehschrank-fuer-wohnzimmer-schlafzimmer-modernes-tv-board-hochglanz-schwarz-S06F102O/?variationId=S06F102ONAS7,"WLIVE TV-Schrank 135/160 cm Lowboard mit RGB-LED für Fernseher bis 60/65/70 Zoll, (20 Farben RGB Fernsehschrank für Wohnzimmer, Schlafzimmer) Modernes TV Board, Weiß","WLIVE TV-Schrank 135/160 cm Lowboard mit RGB-LED für Fernseher bis 60/65/70 Zoll, (20 Farben RGB Fernsehschrank für Wohnzimmer, Schlafzimmer) Modernes TV Board, Weiß",302,,"TV-Schrank 135/160 cm Lowboard mit RGB-LED für Fernseher bis 60/65/70 Zoll, (20 Farben RGB Fernsehschrank für Wohnzimmer, Schlafzimmer) Modernes TV Board, Weiß",TV-Schrank 135/160 cm Lowboard mit RGB-LED für Fernseher bis 60/65/70 Zoll,https://www.otto.de/p/wlive-tv-schrank-135-160-cm-lowboard-mit-rgb-led-fuer-fernseher-bis-60-65-70-zoll-20-farben-rgb-fernsehschrank-fuer-wohnzimmer-schlafzimmer-modernes-tv-board-hochglanz-schwarz-S06F102O/,"92,99 €","169,99 €",-45%,"92,99 €","169,99 €",-45%,True,True,,,,,lieferbar - in 4-5 Werktagen bei dir,Available - at your door in 4-5 working days,AVAILABLE,30,3.5,,,,https://i.otto.de/i/otto/d1d29813-7a39-4eac-87e3-a2734a35e434?$responsive_ft2$,WLIVE,Schränke,,,,,False,,,"exclude_keyword:tv-schrank,fernsehschrank,schrank,lowboard,tv board",False
